### ISSUE TITLE
liboas in LD_PRELOAD stops podman/pasta from working.

### ISSUE THREAD

**Issue by Zugschlus** [ThomasNoll/oas#9]
See (on Debian unstable):

```
$ echo $LD_PRELOAD; podman run --rm -ti debian:sid-slim apt update
/usr/lib/x86_64-linux-gnu/liboas.so
Ign:1 http://deb.debian.org/debian sid InRelease  
Ign:1 http://deb.debian.org/debian sid InRelease  
Ign:1 http://deb.debian.org/debian sid InRelease
Err:1 http://deb.debian.org/debian sid InRelease
  Cannot initiate the connection to deb.debian.org:80 (146.75.122.132). - connect (101: Network is unreachable) Could not connect to deb.debian.org:80 (2a04:4e42:8e::644), connection timed out
  Temporary failure resolving 'deb.debian.org'
All packages are up to date.    
Warning: Failed to fetch http://deb.debian.org/debian/dists/sid/InRelease  Temporary failure resolving 'deb.debian.org'
Warning: Some index files failed to download. They have been ignored, or old ones used instead.
$ LD_PRELOAD="" podman run --rm -ti debian:sid-slim apt update
Get:1 http://deb.debian.org/debian sid InRelease [187 kB]
Get:2 http://deb.debian.org/debian sid/main amd64 Packages [10.2 MB]
Fetched 10.4 MB in 3s (3919 kB/s)   
23 packages can be upgraded. Run 'apt list --upgradable' to see them.
$ 
```

Here pcap of the container with LD_PRELOAD in place.
```
21:14:01.750100 ARP, Request who-has 192.168.182.206 tell 192.168.182.206, length 46
21:14:01.750117 ARP, Request who-has 192.168.182.254 tell 192.168.182.254, length 46
21:14:01.750149 IP6 fe80::1 > ff02::1: ICMP6, neighbor advertisement, tgt is fe80::1, length 32
21:14:01.750159 IP6 fe80::1 > ff02::1: ICMP6, neighbor advertisement, tgt is fe80::5427:b8ff:fee7:96e, length 32
21:14:01.751401 IP6 fe80::b0db:5ff:fe57:7dc1 > ff02::2: ICMP6, router solicitation, length 16
21:14:01.751414 ARP, Reply 192.168.182.31 is-at b2:db:05:57:7d:c1, length 28
21:14:01.751422 IP6 2a01:238:43fa:bc82::1f:100 > ff02::1:ff00:1: ICMP6, neighbor solicitation, who has fe80::1, length 32
21:14:01.751504 IP6 fe80::1 > 2a01:238:43fa:bc82::1f:100: ICMP6, neighbor advertisement, tgt is fe80::1, length 32
21:14:01.752250 IP6 2a01:238:43fa:bc82::1f:100 > fe80::1: ICMP6, neighbor advertisement, tgt is 2a01:238:43fa:bc82::1f:100, length 24
21:14:01.756019 IP6 fe80::b0db:5ff:fe57:7dc1 > ff02::16: HBH ICMP6, multicast listener report v2, 2 group record(s), length 48
21:14:01.836424 IP 192.168.182.31.33528 > 169.254.1.1.53: 62518+ A? deb.debian.org. (32)
21:14:01.836443 IP 192.168.182.31.33528 > 169.254.1.1.53: 24880+ AAAA? deb.debian.org. (32)
21:14:01.842140 IP 169.254.1.1.53 > 192.168.182.31.33528: 62518 2/0/0 CNAME debian.map.fastlydns.net., A 146.75.122.132 (86)
21:14:01.842358 IP 169.254.1.1.53 > 192.168.182.31.33528: 24880 2/0/0 CNAME debian.map.fastlydns.net., AAAA 2a04:4e42:8e::644 (98)
21:14:01.842602 IP6 2a01:238:43fa:bc82::1f:100.48224 > 2a04:4e42:8e::644.80: Flags [S], seq 4165854294, win 65460, options [mss 65460,sackOK,TS val 2679084126 ecr 0,nop,wscale 10], length 0
```

See the TCP SYN to 2a04:4e42:8e::644 port 80. The source address is correct.  I see that packet coming out of the container, but it never leaves the host.

**Comment by ThomasNoll** [comment]
What does correct source address mean? Same as without oas?
If not, is it configured for apt, podman or pasta?

**Comment by Zugschlus** [comment]
The source address is one of the the correct source addressses that is assigned to the outgoing interface of the host. and the same one that the host successfully uses to connect to this IP address, both with LD_PRELOAD in place and not.

The container doesn't have any oas configuration, and the oas configuration of the host only has rules for git and ssh.
